{
  "organization_id": "a0000000-0000-4000-8000-000000000001",
  "id": "b0000000-0000-4000-8000-000000000003",
  "requested_by": "b0000000-0000-4000-8000-000000000004",
  "format": "xlsx",
  "purpose": "academic_contact_research",
  "state": "queued",
  "reason": "scheduled",
  "revision": 1,
  "generation": 1,
  "download_available": false,
  "contacts": 1,
  "article_outcomes": 1,
  "created_at": "2026-10-13T00:00:00Z",
  "expires_at": "2026-10-13T01:00:00Z",
  "synthetic": true,
  "production_enabled": false
}
